{
  "schema_version": "skillguard.work_contract.v1",
  "skill_id": "{{skill_id}}",
  "target_path": "{{target_path}}",
  "contract_version": "1",
  "contract_hash": "{{contract_hash}}",
  "routes": [
    {
      "route_id": "audit",
      "summary": "Inspect the target skill and close only after required checks pass.",
      "activation_keywords": [
        "audit",
        "review",
        "check"
      ],
      "do_not_use_when": [
        "The task is outside this skill's activation boundary."
      ],
      "phase_order": [
        "intake",
        "inventory",
        "evidence",
        "checks",
        "closure"
      ]
    }
  ],
  "phases": [
    {
      "phase_id": "intake",
      "summary": "Confirm target, requested outcome, route, and claim boundary.",
      "required_evidence": [
        "task_summary"
      ],
      "required_checks": [
        "check_route"
      ],
      "allowed_next": [
        "inventory"
      ]
    },
    {
      "phase_id": "inventory",
      "summary": "Inspect current target files and supported local materials.",
      "required_evidence": [
        "target_inventory"
      ],
      "required_checks": [
        "check_phase_order"
      ],
      "allowed_next": [
        "evidence"
      ]
    },
    {
      "phase_id": "evidence",
      "summary": "Collect current direct evidence for the declared scope.",
      "required_evidence": [
        "direct_evidence"
      ],
      "required_checks": [
        "check_evidence"
      ],
      "allowed_next": [
        "checks"
      ]
    },
    {
      "phase_id": "checks",
      "summary": "Run required checks and quality-floor gates.",
      "required_evidence": [
        "check_output"
      ],
      "required_checks": [
        "check_quality_floor"
      ],
      "allowed_next": [
        "closure"
      ]
    },
    {
      "phase_id": "closure",
      "summary": "Close only inside the evidence-backed claim boundary.",
      "required_evidence": [
        "closure_report"
      ],
      "required_checks": [
        "check_closure"
      ],
      "allowed_next": []
    }
  ],
  "required_evidence": [
    {
      "evidence_id": "task_summary",
      "phase_id": "intake",
      "kind": "task_record",
      "source": ".skillguard/runs/",
      "required": true
    },
    {
      "evidence_id": "target_inventory",
      "phase_id": "inventory",
      "kind": "file_inventory",
      "source": ".skillguard/runs/",
      "required": true
    },
    {
      "evidence_id": "direct_evidence",
      "phase_id": "evidence",
      "kind": "direct_evidence",
      "source": ".skillguard/runs/",
      "required": true
    },
    {
      "evidence_id": "check_output",
      "phase_id": "checks",
      "kind": "command_output",
      "source": ".skillguard/runs/",
      "required": true
    },
    {
      "evidence_id": "closure_report",
      "phase_id": "closure",
      "kind": "closure_record",
      "source": ".skillguard/runs/",
      "required": true
    }
  ],
  "quality_floors": [
    {
      "floor_id": "no_prose_only_completion",
      "summary": "Do not replace required command or file evidence with prose-only claims.",
      "required_checks": [
        "check_evidence",
        "check_quality_floor"
      ],
      "failure_effect": "block checked or accepted closure"
    }
  ],
  "forbidden_shortcuts": [
    {
      "shortcut_id": "skip_to_closure",
      "summary": "Do not move directly from intake or planning to closure without current phase evidence and required checks."
    }
  ],
  "check_scripts": [
    {
      "check_id": "check_route",
      "phase_id": "intake",
      "script_path": ".skillguard/checks/check_route.py",
      "command": "python .skillguard/checks/check_route.py",
      "required": true,
      "failure_class": "route"
    },
    {
      "check_id": "check_phase_order",
      "phase_id": "inventory",
      "script_path": ".skillguard/checks/check_phase_order.py",
      "command": "python .skillguard/checks/check_phase_order.py",
      "required": true,
      "failure_class": "phase_order"
    },
    {
      "check_id": "check_evidence",
      "phase_id": "evidence",
      "script_path": ".skillguard/checks/check_evidence.py",
      "command": "python .skillguard/checks/check_evidence.py",
      "required": true,
      "failure_class": "evidence"
    },
    {
      "check_id": "check_quality_floor",
      "phase_id": "checks",
      "script_path": ".skillguard/checks/check_quality_floor.py",
      "command": "python .skillguard/checks/check_quality_floor.py",
      "required": true,
      "failure_class": "quality_floor"
    },
    {
      "check_id": "check_closure",
      "phase_id": "closure",
      "script_path": ".skillguard/checks/check_closure.py",
      "command": "python .skillguard/checks/check_closure.py",
      "required": true,
      "failure_class": "closure"
    }
  ],
  "closure_rules": [
    {
      "rule_id": "accepted_requires_all_required_checks",
      "scope": "declared run scope only",
      "allowed_decision": "accepted",
      "required_checks": [
        "check_route",
        "check_phase_order",
        "check_evidence",
        "check_quality_floor",
        "check_closure"
      ],
      "required_evidence": [
        "task_summary",
        "target_inventory",
        "direct_evidence",
        "check_output",
        "closure_report"
      ]
    }
  ],
  "stale_bindings": [
    {
      "binding_id": "target_skill_prompt",
      "path": "SKILL.md",
      "stales": [
        "route_selection",
        "run_record",
        "closure_report"
      ]
    }
  ],
  "claim_boundary": "This work contract governs only the declared target skill and local run evidence. It does not prove packaged CLI support, package publication, external services, future AI correctness, or broader release readiness."
}
